{
 "neurons": [
  {
   "type": "hidden",
   "uuid": "hidden-0",
   "bias": -2.302585092994046,
   "squash": "IDENTITY"
  },
  {
   "type": "output",
   "uuid": "output-0",
   "bias": 1.4142135623730951,
   "squash": "TANH"
  }
 ],
 "synapses": [
  {
   "weight": 0.4342944819032518,
   "fromUUID": "input-0",
   "toUUID": "hidden-0"
  },
  {
   "weight": -1,
   "fromUUID": "input-1",
   "toUUID": "hidden-0"
  },
  {
   "weight": 1,
   "fromUUID": "input-2",
   "toUUID": "hidden-0"
  },
  {
   "weight": 2.718281828459045,
   "fromUUID": "input-3",
   "toUUID": "hidden-0"
  },
  {
   "weight": -0.7071067811865476,
   "fromUUID": "input-4",
   "toUUID": "hidden-0"
  },
  {
   "weight": -1.4142135623730951,
   "fromUUID": "input-5",
   "toUUID": "hidden-0"
  },
  {
   "weight": 3.141592653589793,
   "fromUUID": "hidden-0",
   "toUUID": "output-0"
  }
 ],
 "input": 6,
 "output": 1
}