{
  "neurons": [
    {
      "type": "hidden",
      "uuid": "6ea0e3fa-6604-47d8-8e36-4ade7a486bcd",
      "bias": -6.2955517,
      "squash": "MEAN"
    },
    {
      "type": "output",
      "uuid": "output-0",
      "bias": -18.6449744,
      "squash": "LOGISTIC"
    }
  ],
  "synapses": [
    {
      "weight": 6.1284484,
      "fromUUID": "input-0",
      "toUUID": "6ea0e3fa-6604-47d8-8e36-4ade7a486bcd"
    },
    {
      "weight": -1.0153550999999998,
      "fromUUID": "6ea0e3fa-6604-47d8-8e36-4ade7a486bcd",
      "toUUID": "6ea0e3fa-6604-47d8-8e36-4ade7a486bcd"
    },
    {
      "weight": -3.5146241,
      "fromUUID": "6ea0e3fa-6604-47d8-8e36-4ade7a486bcd",
      "toUUID": "output-0"
    }
  ],
  "input": 1,
  "output": 1,
  "tags": [
    {
      "name": "untrained-error",
      "value": "0.15057189005964375"
    },
    {
      "name": "untrained-score",
      "value": "-0.15112115528668327"
    },
    {
      "name": "approach",
      "value": "fine"
    },
    {
      "name": "trainID",
      "value": "d2cd9738"
    },
    {
      "name": "trained",
      "value": "YES"
    },
    {
      "name": "error",
      "value": "0.004974774013944765"
    },
    {
      "name": "score",
      "value": "-0.005557368065211575"
    },
    {
      "name": "adjusted",
      "value": "1 weight, 1 bias"
    },
    {
      "name": "old-score",
      "value": "-0.005954097665740331"
    }
  ]
}
