{
  "input": 2,
  "output": 2,
  "neurons": [
    {
      "type": "hidden",
      "uuid": "f1e2d3c4-0001-4001-8000-000000000001",
      "bias": 0.06,
      "squash": "TANH"
    },
    {
      "type": "hidden",
      "uuid": "f1e2d3c4-0001-4001-8000-000000000002",
      "bias": -0.03,
      "squash": "TANH"
    },
    {
      "type": "hidden",
      "uuid": "f1e2d3c4-0001-4001-8000-000000000003",
      "bias": 0.015,
      "squash": "RELU"
    },
    {
      "type": "hidden",
      "uuid": "f1e2d3c4-0001-4001-8000-000000000004",
      "bias": 0.005,
      "squash": "TANH"
    },
    {
      "type": "hidden",
      "uuid": "f1e2d3c4-0001-4001-8000-000000000005",
      "bias": -0.045,
      "squash": "RELU"
    },
    {
      "type": "output",
      "uuid": "output-0",
      "bias": 0.01,
      "squash": "LOGISTIC"
    },
    {
      "type": "output",
      "uuid": "output-1",
      "bias": 0.0,
      "squash": "LOGISTIC"
    }
  ],
  "synapses": [
    {
      "fromUUID": "input-0",
      "toUUID": "f1e2d3c4-0001-4001-8000-000000000001",
      "weight": 0.55
    },
    {
      "fromUUID": "input-0",
      "toUUID": "f1e2d3c4-0001-4001-8000-000000000005",
      "weight": -0.65
    },
    {
      "fromUUID": "input-1",
      "toUUID": "f1e2d3c4-0001-4001-8000-000000000002",
      "weight": 0.7
    },
    {
      "fromUUID": "f1e2d3c4-0001-4001-8000-000000000001",
      "toUUID": "f1e2d3c4-0001-4001-8000-000000000003",
      "weight": 0.45
    },
    {
      "fromUUID": "f1e2d3c4-0001-4001-8000-000000000002",
      "toUUID": "f1e2d3c4-0001-4001-8000-000000000003",
      "weight": 0.35
    },
    {
      "fromUUID": "f1e2d3c4-0001-4001-8000-000000000003",
      "toUUID": "f1e2d3c4-0001-4001-8000-000000000004",
      "weight": 0.55
    },
    {
      "fromUUID": "f1e2d3c4-0001-4001-8000-000000000004",
      "toUUID": "output-0",
      "weight": 0.85
    },
    {
      "fromUUID": "f1e2d3c4-0001-4001-8000-000000000005",
      "toUUID": "output-1",
      "weight": 0.45
    },
    {
      "fromUUID": "f1e2d3c4-0001-4001-8000-000000000003",
      "toUUID": "output-1",
      "weight": 0.25
    }
  ]
}
