{
  "neurons": [
    {
      "type": "hidden",
      "uuid": "hidden-0",
      "bias": -1,
      "squash": "IDENTITY"
    },
    {
      "type": "output",
      "uuid": "output-0",
      "bias": 2,
      "squash": "IDENTITY"
    }
  ],
  "synapses": [
    {
      "weight": -1,
      "fromUUID": "input-0",
      "toUUID": "hidden-0"
    },
    {
      "weight": 1,
      "fromUUID": "hidden-0",
      "toUUID": "output-0"
    }
  ],
  "input": 1,
  "output": 1
}
