{
  "semanticVersion": "1.0.0",
  "neurons": [
    {
      "type": "hidden",
      "uuid": "5148aa55-bb11-4b5f-93a2-0003a4f99a8c",
      "id": 1891321776,
      "bias": -0.11126319999999999,
      "squash": "LOGISTIC"
    },
    {
      "type": "hidden",
      "uuid": "d1cb0e8c-4275-482f-81e0-07c5e33258c2",
      "id": 1707239460,
      "bias": -0.0951009,
      "squash": "LOGISTIC"
    },
    {
      "type": "hidden",
      "uuid": "5c8f88d8-084f-4a68-a297-115ef4bc8ffc",
      "id": 1001959296,
      "bias": -0.2273122,
      "squash": "LOGISTIC"
    },
    {
      "type": "hidden",
      "uuid": "ab65eb53-3c26-44c8-b844-5dc9da0f937e",
      "id": 1870286150,
      "bias": 0.0236654,
      "squash": "LOGISTIC"
    },
    {
      "type": "output",
      "uuid": "output-0",
      "id": -1,
      "bias": -0.028760499999999998,
      "squash": "LOGISTIC"
    }
  ],
  "synapses": [
    {
      "weight": -0.0306392,
      "fromUUID": "input-0",
      "fromId": 0,
      "toUUID": "5148aa55-bb11-4b5f-93a2-0003a4f99a8c",
      "toId": 1891321776
    },
    {
      "weight": -0.3574128,
      "fromUUID": "input-0",
      "fromId": 0,
      "toUUID": "d1cb0e8c-4275-482f-81e0-07c5e33258c2",
      "toId": 1707239460
    },
    {
      "weight": -0.054157,
      "fromUUID": "input-0",
      "fromId": 0,
      "toUUID": "5c8f88d8-084f-4a68-a297-115ef4bc8ffc",
      "toId": 1001959296
    },
    {
      "weight": -0.2579322,
      "fromUUID": "input-0",
      "fromId": 0,
      "toUUID": "ab65eb53-3c26-44c8-b844-5dc9da0f937e",
      "toId": 1870286150
    },
    {
      "weight": -0.016578199999999998,
      "fromUUID": "5148aa55-bb11-4b5f-93a2-0003a4f99a8c",
      "fromId": 1891321776,
      "toUUID": "output-0",
      "toId": -1
    },
    {
      "weight": 0.0834669,
      "fromUUID": "d1cb0e8c-4275-482f-81e0-07c5e33258c2",
      "fromId": 1707239460,
      "toUUID": "output-0",
      "toId": -1
    },
    {
      "weight": -0.020502899999999998,
      "fromUUID": "5c8f88d8-084f-4a68-a297-115ef4bc8ffc",
      "fromId": 1001959296,
      "toUUID": "output-0",
      "toId": -1
    },
    {
      "weight": -0.0087463,
      "fromUUID": "ab65eb53-3c26-44c8-b844-5dc9da0f937e",
      "fromId": 1870286150,
      "toUUID": "output-0",
      "toId": -1
    }
  ],
  "input": 1,
  "output": 1
}
